{
  "$schema": "https://erdesigns.eu/schema/oem-overlay.json",
  "schema_version": 1,
  "description": "stellantis-specific UDS Data Identifier overlay seed. Add entries here; TOBDOEMCatalog loads them into the OEM registry at runtime.",
  "kind": "uds-did",
  "oem": "stellantis",
  "dids": [
  ]
}
